Information Horizon Maps,"‚ÄúThe methodology primarily consists of an interview during which study participants are asked to provide a graphical and verbal articulation of their information horizon in a particular context. That is, each study participant is asked to draw a map of his or her information horizons showing all information resources, including people, they typically access when seeking information within a specific context. Each study participant is also asked to describe the information resources and explain their importance and role in the information-seeking process.‚Äù (Sonnenwald, 2001, p. 191)

‚Äúthe concept/theory of information horizons suggest that certain types of data are important for increasing our understanding of human information behavior. These data include decisions made and activities undertaken during the information seeking process; when and why information resources, including individuals, are accessed (and not accessed); relationships or interconnectedness among information resources; individual preferences and evaluation of information resources; the proactive nature of information resources; and the impact of contexts and situations on the information seeking process.
The methodological question addressed by the current study is whether study participants would be able to articulate or describe their information horizons graphically and verbally. Such graphical and verbal articulation could provide an extremely rich view of people‚Äôs information horizons and information behavior in general.‚Äù (Sonnenwald et al., 2005, p. 4-5)

‚ÄúThe combination of graphic and verbal representations of the participants‚Äô information horizons provided much more breadth and much more depth than is possible to attain through use of the more traditional surveys of people‚Äôs resource use. The maps consolidate the information reported in multiple specific information seeking incidents, thus integrating the generality of the map with the specificity of critical incident reports. This technique is much less labor intensive than direct observation of people‚Äôs information seeking activities. Finally, the method itself (incorporating both verbal description and graphical representation) provides data triangulation, thus improving its validity.‚Äù (Sonnenwald et al., 2005, p. 19)","Sonnenwald, D. H., Wildemuth, B. M., & Harmon, G. (2001). A research method using the concept of information horizons: An example from a study of lower socio-economic students‚Äô information seeking behavior. The New Review of Information Behavior Research, 2, 65-86.;
Sonnenwald, D. H. (2005). Information horizons. In Fisher, K. E., Erdelez, S., & McKechnie, L. E. F. (Eds.), Theories of Information Behavior (pp. 191-197). American Society for Information Science and Technology.",,
Longitudinal Study,Employs continuous or repeated measures to follow particular individuals over prolonged periods of time‚Äîoften years or decades.,"Mills, A. J., Durepos, G., & Wiebe, E. (2010). Encyclopedia of case study research (Vols. 1-0). Thousand Oaks, CA: SAGE Publications, Inc. doi: 10.4135/9781412957397
Caruana, E. J., Roman, M., Hern√°ndez-S√°nchez, J., & Solli, P. (2015). Longitudinal studies. Journal of thoracic disease, 7(11), E537‚ÄìE540. https://doi.org/10.3978/j.issn.2072-1439.2015.10.63",,New Node
Cohort Studies,"A type of longitudinal Study performed on a group of people who share a defining characteristic, typically who experienced a common event in a selected period, such as birth or graduation","Eldredge J. (2002). Cohort studies in health sciences librarianship. Journal of the Medical Library Association : JMLA, 90(4), 380‚Äì392.
Miller A.B., Goff D.C., Bammann K., Wild P. (2005) Cohort Studies. In: Ahrens W., Pigeot I. (eds) Handbook of Epidemiology. Springer, Berlin, Heidelberg. https://doi.org/10.1007/978-3-540-26577-1_6",https://en.wikipedia.org/wiki/Cohort_study,New Node
Verstehen,"The manifestation of postpositivism in the social sciences can be found in the work of Max Weber who established the concept of ""Verstehen"". The concept of Verstehen emphasizes the recognition of the social world that social realities need to be understood from the perspective of the subject rather than that of the observer and in totality rather than in isolation (Given, 2008). The process of Verstehen involves understanding the intention and context of these social realities for the subject herself or himself (Given, 2008). To take a postpositivist approach, one needs to incorporate qualitative methods and triangulation through many sources to enable verstehen (Sifat, 2016). ","Given, L. M. (2008). The SAGE encyclopedia of qualitative research methods (Vols. 1-0). Thousand Oaks, CA: SAGE Publications, Inc. 
Sifat, I. (2016, November 25). Post-Positivism and Research Philosophy. Retrieved December 13, 2020, from https://sifat.asia/category/research/philosophy/",,New Node
Materialism/materiality,"Materialism/materiality is a philosophical monism and also a mode of analysis. The traditional philosophical understanding of materialism/materiality is that of matter and content. A Marxist analysis would say that it is not inert matter but a rather a series of interpersonal transactions of conflicting interests; Althusser's formulation is that of materialism/materiality-as-practice (ideology has a material existence in an apparatus and its practice or practices) (Chow 2010); Karen Barad moves the question of materiality into a field of political interaction that takes account of all participatory elements (Mackinnon 2016), etc. ","Chow, R. (2010). The Elusive Material, What the Dog Doesn‚Äôt Understand. In D. Coole & S. Frost (Eds.), New Materialisms: Ontology, Agency, and Politics. Duke University Press.; Mackinnon, L. (2016). Toward a Materialist Photography: The Body of Work. Third Text, 30(3-4): 149-158. https://doi-org.proxy-um.researchport.umd.edu/10.1080/09528822.2017.1290899.",https://en.wikipedia.org/wiki/Materialism,New Node
field study,"A field study or field research (not field experiments) is a general method for collecting data about users, user needs, and product requirements that involves observation and interviewing.","Robben, A. C., & Sluka, J. A. (Eds.). (2012). Ethnographic fieldwork: An anthropological reader (Vol. 23). John Wiley & Sons.",https://en.wikipedia.org/wiki/Field_research,New Node